{
  "$schema": "https://json-schema.org/draft/2020-12/schema",
  "type": "object",
  "properties": {
    "sceneSummary": { "type": "string" },
    "lightingStyle": { "type": "string" },
    "atmosphere": {
      "type": "object",
      "properties": {
        "preset": { "type": "string" },
        "brightness": { "type": "string" },
        "contrast": { "type": "string" },
        "warmth": { "type": "string" },
        "intensityScale": { "type": "number" },
        "notes": { "type": "string" }
      },
      "additionalProperties": true
    },
    "globalSettings": {
      "type": "object",
      "properties": {
        "exposure": { "type": "number" },
        "environmentIntensity": { "type": "number" },
        "intensityScale": { "type": "number" },
        "notes": { "type": "string" }
      },
      "additionalProperties": true
    },
    "ambientLight": {
      "type": "object",
      "properties": {
        "color": { "type": "string" },
        "intensity": { "type": "number" }
      },
      "additionalProperties": true
    },
    "hemisphereLight": {
      "type": "object",
      "properties": {
        "skyColor": { "type": "string" },
        "groundColor": { "type": "string" },
        "intensity": { "type": "number" }
      },
      "additionalProperties": true
    },
    "mainDirectionalLight": {
      "type": "object",
      "properties": {
        "color": { "type": "string" },
        "intensity": { "type": "number" },
        "position": {
          "type": "object",
          "properties": {
            "x": { "type": "number" },
            "y": { "type": "number" },
            "z": { "type": "number" }
          },
          "additionalProperties": true
        },
        "target": {
          "type": "object",
          "properties": {
            "x": { "type": "number" },
            "y": { "type": "number" },
            "z": { "type": "number" }
          },
          "additionalProperties": true
        },
        "castShadow": { "type": "boolean" }
      },
      "additionalProperties": true
    },
    "lights": {
      "type": "array",
      "items": {
        "type": "object",
        "properties": {
          "id": { "type": "string" },
          "name": { "type": "string" },
          "type": { "type": "string" },
          "sourceKind": { "type": "string" },
          "emitMode": { "type": "string" },
          "fixtureShape": { "type": "string" },
          "role": { "type": "string" },
          "anchorObjectId": { "type": "string" },
          "color": { "type": "string" },
          "groundColor": { "type": "string" },
          "intensity": { "type": "number" },
          "distance": { "type": ["number", "null"] },
          "decay": { "type": ["number", "null"] },
          "angle": { "type": ["number", "null"] },
          "penumbra": { "type": ["number", "null"] },
          "width": { "type": ["number", "null"] },
          "height": { "type": ["number", "null"] },
          "castShadow": { "type": "boolean" },
          "position": {
            "type": "object",
            "properties": {
              "x": { "type": "number" },
              "y": { "type": "number" },
              "z": { "type": "number" }
            },
            "required": ["x", "y", "z"],
            "additionalProperties": true
          },
          "target": {
            "type": ["object", "null"],
            "properties": {
              "x": { "type": "number" },
              "y": { "type": "number" },
              "z": { "type": "number" }
            },
            "additionalProperties": true
          },
          "direction": {
            "type": ["object", "null"],
            "properties": {
              "x": { "type": "number" },
              "y": { "type": "number" },
              "z": { "type": "number" }
            },
            "additionalProperties": true
          },
          "rotation": {
            "type": ["object", "null"],
            "properties": {
              "x": { "type": "number" },
              "y": { "type": "number" },
              "z": { "type": "number" }
            },
            "additionalProperties": true
          },
          "reason": { "type": "string" }
        },
        "required": ["id", "type", "position"],
        "additionalProperties": true
      }
    }
  },
  "required": ["sceneSummary", "lights"],
  "additionalProperties": true
}