{
  "sceneSummary": "",
  "lightingStyle": "",
  "atmosphere": {
    "preset": "focused-task-studio",
    "brightness": "medium-low",
    "contrast": "high",
    "warmth": "cool-neutral",
    "intensityScale": 0.9,
    "notes": ""
  },
  "globalSettings": {
    "exposure": 0.78,
    "environmentIntensity": 0.06,
    "intensityScale": 0.92,
    "notes": ""
  },
  "ambientLight": {
    "color": "#ffffff",
    "intensity": 0.02
  },
  "hemisphereLight": {
    "skyColor": "#90b8ff",
    "groundColor": "#3a2b1f",
    "intensity": 0.05
  },
  "mainDirectionalLight": {
    "color": "#7aa7ff",
    "intensity": 0.35,
    "position": { "x": 0, "y": 2, "z": -5 },
    "target": { "x": 0, "y": 1, "z": 0 },
    "castShadow": true
  },
  "lights": [
    {
      "id": "example-1",
      "name": "示例壁灯",
      "type": "spot",
      "sourceKind": "practical-fixture",
      "emitMode": "mixed",
      "fixtureShape": "sconce",
      "role": "fill",
      "anchorObjectId": "",
      "color": "#fff4dd",
      "intensity": 0.55,
      "distance": 1.8,
      "decay": 1,
      "angle": 0.28,
      "penumbra": 0.22,
      "castShadow": false,
      "position": { "x": 0, "y": 2, "z": 0 },
      "target": { "x": 0, "y": 1, "z": 0 },
      "width": null,
      "height": null,
      "rotation": null,
      "reason": "示例占位，说明壁灯应使用世界单位和适中的 spot 参数。"
    }
  ]
}